{
  "intentHash": "a1b2c3d4e5f6a7b8c9d0e1f2a3b4c5d6e7f8a9b0c1d2e3f4a5b6c7d8e9f0a1b2",
  "componentName": "PatientVitals",
  "intentCategory": "clinical",
  "compilationStatus": "pass",
  "forgeMode": "none",
  "forgeUsed": false,
  "latencyMs": 23.4,
  "selfCorrectionAttempts": 0,
  "correctionTokensUsed": 0,
  "timestamp": "2026-02-26T14:30:00.000Z",
  "sdkVersion": "0.1.0",
  "registrySize": 47,
  "platform": "web"
}
